Job Title,Company,Skills,Location,Salary,Experience,Posted,Link
Technology Trainer,BRAIN O VISION SOLUTIONS INDIA PRIVATE LIMITED,"Artificial Intelligence Markup Language (AIML), Blockchain, Data Analytics, Internet of Things (IoT), Robotics, Web development",Hyderabad,"₹ 3,30,000 - 5,50,000",1 year(s),7 days ago,https://internshala.com/job/detail/technology-trainer-job-in-hyderabad-at-brain-o-vision-solutions-india-private-limited1778736039
Field Sales Executive,Onwords Living Homes,"Effective Communication, English Proficiency (Spoken), Interpersonal skills, Kannada Proficiency (Spoken), Sales Strategy, Telugu Proficiency (Spoken), Travel Management","Chennai,Hyderabad,Bangalore","₹ 3,30,000 - 5,40,000",1 year(s),N/A,https://internshala.com/job/detail/field-sales-executive-job-in-multiple-locations-at-anushya-r1778344064
Junior Video Editor,Ipix Movies,"Adobe After Effects, Adobe Premiere Pro, Video Editing, Video Making",Mumbai,"₹ 3,30,000 - 5,30,000",1 year(s),N/A,https://internshala.com/job/detail/junior-video-editor-job-in-mumbai-at-ipix-movies1776938171
Co-ordination Manager (Female),Finworld Financial Services,"Client Relationship Management (CRM), Community Management, Multitasking, Time Management",Pune,"₹ 3,30,000 - 5,30,000",1 year(s),N/A,https://internshala.com/job/detail/co-ordination-manager-female-job-in-pune-at-finworld-financial-services1775474669
Junior Motion Graphics Executive,KRAFTZWORKS,"Adobe After Effects, Adobe Illustrator, Adobe Photoshop",Chennai,"₹ 3,30,000 - 4,80,000",1 year(s),N/A,https://internshala.com/job/detail/junior-motion-graphics-executive-job-in-chennai-at-kraftzworks1778068503
Sales Executive,Cryoviva Biotech Private Limited,"Client Relationship, Effective Communication, Interpersonal skills, Negotiations, Presentation skills","Delhi,Gurgaon,Hyderabad,Noida,Bangalore","₹ 3,30,000 - 4,50,000",1 year(s),N/A,https://internshala.com/job/detail/sales-executive-job-in-multiple-locations-at-cryoviva-biotech-private-limited1778044815
Business Development Executive,Makenica,"B2B Sales, Business Development, Business Management, Client Relationship, Effective Communication, Time Management",Bangalore,"₹ 3,30,000 - 4,50,000",1 year(s),N/A,https://internshala.com/job/detail/business-development-executive-job-in-bangalore-at-makenica1776925067
Content Producer And Strategist,Property Spotters,"Content Marketing, Content Writing, English Proficiency (Spoken), Videography","Delhi,Gurgaon","₹ 3,30,000 - 4,30,000",1 year(s),Today,https://internshala.com/job/detail/content-producer-and-strategist-job-in-multiple-locations-at-property-spotters1779362732
Business Development Executive,Gharpayy,"Digital Marketing, English Proficiency (Spoken), English Proficiency (Written), Social Media Marketing",Bangalore,"₹ 3,30,000 - 3,50,000",No experience required,N/A,https://internshala.com/job/detail/fresher-business-development-executive-job-in-bangalore-at-gharpayy1777380492
Customer Service Associate,Ecliptic Insight Ventures,"English Proficiency (Spoken), English Proficiency (Written), Hindi Proficiency (Spoken)","Jaipur,Gurgaon","₹ 3,25,000 - 4,50,000",No experience required,N/A,https://internshala.com/job/detail/fresher-customer-service-associate-job-in-multiple-locations-at-ecliptic-insight-ventures1776852740
Digital Marketing Executive,EcoCare Technologies Private Limited,"Digital Marketing, English Proficiency (Written), Graphic Design, Instagram Marketing, Search Engine Marketing (SEM), Social Media Marketing",Noida,"₹ 3,25,000 - 4,30,000",1 year(s),N/A,https://internshala.com/job/detail/digital-marketing-executive-job-in-noida-at-ecocare-technologies-private-limited1777382849
Mechanical Engineer,Re-Cog Infotechnologies Private Limited,"AutoCAD, Six Sigma, SolidWorks",Hyderabad,"₹ 3,25,000 - 3,90,000",1 year(s),N/A,https://internshala.com/job/detail/mechanical-engineer-job-in-hyderabad-at-re-cog-infotechnologies-private-limited1778580775
Business Development Executive,Collaborative Execellence (CoEx),"Cold Calling, Sales Management, Sales Strategy",Work from home,"₹ 3,25,000 - 3,80,000",1 year(s),N/A,https://internshala.com/job/detail/remote-business-development-executive-job-at-collaborative-execellence-coex1778609143
Technical Support (Service Desk Agent),UpGrad Rekrut,"Computer skills, English Proficiency (Spoken), English Proficiency (Written), Technical Support","Chennai,Pune,Bangalore,Ahmednagar,Navi Mumbai,Mumbai,Lonavala,Pimpri-Chinchwad,Lavasa,Mysuru,Kolar,Vellore,Tumakuru,Kanchipuram,Avadi,Mandya,Ramanagara,Cuddalore,Tambaram Sanatorium,Chikkaballapur","₹ 3,25,000 - 3,75,000",No experience required,N/A,https://internshala.com/job/detail/fresher-service-desk-agent-job-in-multiple-locations-at-upgrad-rekrut1776850134
Associate Graphic Designer,Kahihi,"Adobe Creative Suite, Adobe Illustrator, Adobe Photoshop, CorelDRAW, UI & UX Design",Pune(Hybrid),"₹ 3,25,000 - 3,50,000",1 year(s),N/A,https://internshala.com/job/detail/associate-graphic-designer-job-in-pune-at-kahihi1778315897
Drone Engineer,Somya Sharma,"Arduino, Linux, Python","Meerut,Noida","₹ 3,25,000",No experience required,Today,https://internshala.com/job/detail/fresher-drone-engineer-job-in-multiple-locations-at-somya-sharma1779363218
Reconciliation Analyst (Finance),UpGrad Rekrut,"Accounting, Bank Reconciliation, Data Analysis, Data Visualization, Effective Communication, English Proficiency (Spoken), English Proficiency (Written), Finance, Financial Modeling, Financial Services, MS-Excel",Noida,"₹ 3,25,000",No experience required,7 days ago,https://internshala.com/job/detail/fresher-reconciliation-analyst-finance-job-in-noida-at-upgrad-rekrut1778735026
Business Development Executive,HRESO,"Business Development, Sales, Sales Management, Sales Support",Delhi,"₹ 3,24,000 - 9,20,000",No experience required,N/A,https://internshala.com/job/detail/fresher-business-development-executive-job-in-delhi-at-hreso1778222753
Telecaller,Wellindia India,"English Proficiency (Written), Hindi Proficiency (Spoken)",Delhi,"₹ 3,24,000 - 5,00,000",1 year(s),N/A,https://internshala.com/job/detail/telecaller-job-in-delhi-at-wellindia-india1777382679
Business Development Executive,Learning Routes,"Effective Communication, Interpersonal skills",Gurgaon,"₹ 3,24,000 - 4,20,000",No experience required,Today,https://internshala.com/job/detail/fresher-business-development-executive-job-in-gurgaon-at-learning-routes1779343996
Videographer,Amit Kothari,"Adobe After Effects, Adobe Photoshop, Adobe Premiere Pro, Photography, Video Editing, Video Making",Mumbai,"₹ 3,24,000 - 4,10,000",1 year(s),N/A,https://internshala.com/job/detail/videographer-job-in-mumbai-at-amit-kothari1777076130
Junior Software Tester,Ollosoft,"Database Testing, Java, Manual Testing, Python, Software Testing, SQL, Usability Testing",Jaipur,"₹ 3,24,000 - 4,00,000",1 year(s),3 days ago,https://internshala.com/job/detail/junior-software-tester-job-in-jaipur-at-latika-gautam1779104595
Junior Front End Developer,SaffireTech,"Bootstrap, CSS, Frontend development, HTML, JavaScript, jQuery, Responsive Design","Palghar,Thane,Mumbai","₹ 3,24,000 - 4,00,000",No experience required,N/A,https://internshala.com/job/detail/fresher-junior-front-end-developer-job-in-multiple-locations-at-saffiretech1778656130
Client Service Associate,Ontwikkel Corp,"English Proficiency (Spoken), English Proficiency (Written), MS-Excel, MS-Office, MS-PowerPoint",Chennai,"₹ 3,24,000",1 year(s),N/A,https://internshala.com/job/detail/client-service-associate-job-in-chennai-at-ontwikkel-corp1777970323
Business Development Associate,Breakout Marketing,"Client Interaction, Client Relationship, Customer Acquisition, Effective Communication, Sales, Sales Strategy",Bangalore,"₹ 3,20,000 - 13,40,000",No experience required,N/A,https://internshala.com/job/detail/fresher-business-development-associate-job-in-bangalore-at-breakout-marketing1777453111
Travel Sales Consultant,BOOKMYFLIGHTS LTD,"Sales, Travel Itinerary Making, Travel Management",Delhi,"₹ 3,20,000 - 10,00,000",1 year(s),N/A,https://internshala.com/job/detail/travel-sales-consultant-job-in-delhi-at-bookmyflights-ltd1776949798
Retail Sales Assistant,Tvisva Jewels,"Retail Management, Sales",Jalandhar,"₹ 3,20,000 - 9,20,000",1 year(s),6 days ago,https://internshala.com/job/detail/retail-sales-assistant-job-in-jalandhar-at-tvisva-jewels1778835661
Business Development Specialist,Arsh Infosystems,"Digital Marketing, English Proficiency (Spoken), English Proficiency (Written)",Mumbai,"₹ 3,20,000 - 9,00,000",1 year(s),N/A,https://internshala.com/job/detail/business-development-specialist-job-in-mumbai-at-arsh-infosystems1777030353
Business Development Executive,Elbow Grease Business Solutions Private Limited,"Client Relationship Management (CRM), Effective Communication, English Proficiency (Spoken), Interpersonal skills, Negotiation, Problem Solving, Self-learning",Jaipur,"₹ 3,20,000 - 8,10,000",No experience required,N/A,https://internshala.com/job/detail/fresher-business-development-executive-job-in-jaipur-at-elbow-grease-business-solutions-private-limited1778500641
Business Development Associate,Radice Rinnova,"Business Research, Client Interaction, Client Relationship Management (CRM), English Proficiency (Spoken), English Proficiency (Written), Marketing Strategies, MS-Excel, Sales, Social Media Marketing",Mumbai,"₹ 3,20,000 - 8,10,000",1 year(s),N/A,https://internshala.com/job/detail/business-development-associate-job-in-mumbai-at-radice-rinnova1778055109
Corporate Sales Specialist,Outris Imaging Private Limited,"B2B Sales, Banking, Digital Marketing, Email Marketing, MS-Office","Delhi,Gurgaon","₹ 3,20,000 - 7,00,000",1 year(s),N/A,https://internshala.com/job/detail/corporate-sales-specialist-job-in-multiple-locations-at-outris-imaging-private-limited1777963310
Field Sales Associate,ZION ARCADE,"Effective Communication, English Proficiency (Spoken), Negotiation",Chennai(Hybrid),"₹ 3,20,000 - 6,00,000",No experience required,N/A,https://internshala.com/job/detail/fresher-field-sales-associate-job-in-chennai-at-v-john-jayaprakash1778065857
Corporate Sales Associate,Bajaj Alllianz Life Insurance Company,"Client Relationship, Client Relationship Management (CRM), English Proficiency (Spoken), Leadership, Lead Generation, Marketing, Sales, Sales Management, Team Management",Work from home,"₹ 3,20,000 - 5,64,000",No experience required,N/A,https://internshala.com/job/detail/fresher-remote-corporate-sales-associate-job-at-bajaj-alllianz-life-insurance-company1778571767
Online Lead Generation Executive – Remote Job,Infoskaters Technologies Private Limited,"Customer Acquisition, Facebook Ads, Lead Generation, Marketing, Sales",Work from home,"₹ 3,20,000 - 5,50,000",No experience required,6 days ago,https://internshala.com/job/detail/fresher-remote-part-time-online-lead-generation-executive--remote-job-job-at-infoskaters-technologies-private-limited1778820455
Business Development Associate,Madhushree Das,"English Proficiency (Spoken), English Proficiency (Written), MS-Excel, Sales, Social Media Marketing",Work from home,"₹ 3,20,000 - 5,50,000",No experience required,7 days ago,https://internshala.com/job/detail/fresher-remote-business-development-associate-job-at-madhushree-das1778763158
Backend Developer,Kravix,"Django, HTML, Java, MongoDB, MySQL, Node.js, Python",Work from home,"₹ 3,20,000 - 5,50,000",No experience required,N/A,https://internshala.com/job/detail/fresher-remote-backend-developer-job-at-kravix1778409826
Junior Travel & Tourism Manager,The Wise Trippers,"Artificial intelligence, Holiday Package Design, Instagram Marketing, MS-Excel, Research and Analytics, Travel Itinerary Making, Travel Management",Work from home,"₹ 3,20,000 - 5,50,000",1 year(s),N/A,https://internshala.com/job/detail/remote-junior-travel-tourism-manager-job-at-the-wise-trippers1778264586
Business Development Associate,Madhushree Das,"English Proficiency (Spoken), English Proficiency (Written), MS-Excel, Sales, Social Media Marketing",Kolkata,"₹ 3,20,000 - 5,50,000",No experience required,N/A,https://internshala.com/job/detail/fresher-business-development-associate-job-in-kolkata-at-madhushree-das1777530540
Junior Travel & Tourism Associate,Great Himalayan Adventure Studio Private Limited,"English Proficiency (Spoken), English Proficiency (Written), Holiday Package Design, MS-Office, Operations, Sales, Travel Itinerary Making",Palampur,"₹ 3,20,000 - 5,40,000",1 year(s),6 days ago,https://internshala.com/job/detail/junior-travel-tourism-associate-job-in-palampur-at-great-himalayan-adventure-studio-private-limited1778879967
Sales Executive,Quality Finserv Market Private Limited,"Effective Communication, Lead Generation, Time Management",Noida,"₹ 3,20,000 - 5,40,000",No experience required,7 days ago,https://internshala.com/job/detail/fresher-sales-executive-job-in-noida-at-quality-finserv-market-private-limited1778741321
Market Development Lead,Raja A,"Business Development, Effective Communication, Interpersonal skills, Stakeholder Management",Bangalore,"₹ 3,20,000 - 5,40,000",No experience required,7 days ago,https://internshala.com/job/detail/fresher-market-development-lead-job-in-bangalore-at-raja-a1778740913
Business Development Associate,AVM FINSERVE,"Finance, MS-Office, Stock Trading",Kolkata,"₹ 3,20,000 - 5,40,000",1 year(s),N/A,https://internshala.com/job/detail/business-development-associate-job-in-kolkata-at-avm-finserve1777289890
Customer Service Executive,Prdgy,"Client Relationship Management (CRM), Conflict Management, Effective Communication, English Proficiency (Spoken), English Proficiency (Written), Hindi Proficiency (Spoken), Problem Solving",Work from home,"₹ 3,20,000 - 5,40,000",1 year(s),2 days ago,https://internshala.com/job/detail/remote-customer-service-executive-job-at-prdgy1779195841
Founding Partner,Travel Pujaari,"Operations, Sales, Travel Management",Work from home,"₹ 3,20,000 - 5,30,000",1 year(s),7 days ago,https://internshala.com/job/detail/remote-founding-partner-job-at-travel-pujaari1778762867
Big Data Trainee,Tattvam India,"Machine Learning, SQL",Bangalore,"₹ 3,20,000 - 5,20,000",No experience required,N/A,https://internshala.com/job/detail/fresher-big-data-trainee-job-in-bangalore-at-tattvam-india1777528437
Junior Telecaller,Wayone Academy,"Cold Calling, Computer skills, Effective Communication",Delhi,"₹ 3,20,000 - 5,16,000",No experience required,N/A,https://internshala.com/job/detail/fresher-junior-telecaller-job-in-delhi-at-wayone-academy1777614889
Pre-Sales Engineer,Pixelkube Technologies Private Limited,English Proficiency (Spoken),Work from home,"₹ 3,20,000 - 5,00,000",No experience required,7 days ago,https://internshala.com/job/detail/fresher-remote-pre-sales-engineer-job-at-pixelkube-technologies-private-limited1778762466
Junior Recruiter,Cafyo Management Solution,"Cold Calling, Effective Communication, English Proficiency (Spoken)",Raipur,"₹ 3,20,000 - 4,80,000",No experience required,N/A,https://internshala.com/job/detail/fresher-junior-recruiter-job-in-raipur-at-cafyo-management-solution1777533733
Account Executive,Fashor,"Accounting, Financial Reporting",Jaipur,"₹ 3,20,000 - 4,70,000",1 year(s),N/A,https://internshala.com/job/detail/account-executive-job-in-jaipur-at-fashor1778657885
US IT Recruiter,ASCLOUDSECURE,"Effective Communication, English Proficiency (Spoken), English Proficiency (Written), Interview Coordination, Interviewing, Recruitment","Ahmedabad,Chennai,Gurgaon,Indore,Pune,Surat,Hyderabad,Mumbai,Noida,Bangalore","₹ 3,20,000 - 4,50,000",No experience required,3 days ago,https://internshala.com/job/detail/fresher-us-it-recruiter-job-in-multiple-locations-at-ascloudsecure1779092720
Sales Executive,Amol Karale International Academy,"English Proficiency (Spoken), English Proficiency (Written), MS-Excel",Work from home,"₹ 3,20,000 - 4,50,000",1 year(s),N/A,https://internshala.com/job/detail/remote-sales-executive-job-at-amol-karale-international-academy1776947021
Field Sales & Business Development Associate,Inicio Impex Private Limited,"B2B Sales, Client Relationship Management (CRM), Digital Advertising, Digital Marketing, Digital Marketing Tools, English Proficiency (Spoken), Generative AI Tools, Lead Generation, Market Analysis, Marketing Automation, Marketing Campaigns, Marketing Strategies, Market research, Sales Management, Sales Strategy, Sales Support","Mumbai,Navi Mumbai","₹ 3,20,000 - 4,40,000",1 year(s),N/A,https://internshala.com/job/detail/field-sales-business-development-associate-job-in-multiple-locations-at-inicio-impex-private-limited1778474510
Inside Sales Associate,Flurn,"Adaptability, Effective Communication, English Proficiency (Spoken), Interpersonal skills, Sales, Teamwork",Bangalore,"₹ 3,20,000 - 4,40,000",No experience required,N/A,https://internshala.com/job/detail/fresher-inside-sales-associate-job-in-bangalore-at-flurn1777275396
Sales Executive,Global Empire Events Limited,English Proficiency (Spoken),Work from home,"₹ 3,20,000 - 4,20,000",1 year(s),N/A,https://internshala.com/job/detail/remote-sales-executive-job-at-global-empire-events-limited1777965138
Customer Support Manager,Shades Of Spring,"Data Analysis, Effective Communication, MS-Excel, Report Generation, Team Management",Bangalore,"₹ 3,20,000 - 4,10,000",1 year(s),N/A,https://internshala.com/job/detail/customer-support-lead-job-in-bangalore-at-shades-of-spring1777522590
Sales Executive,SkillNest360 Private Limited,Interpersonal skills,Hyderabad,"₹ 3,20,000 - 4,00,000",No experience required,Today,https://internshala.com/job/detail/fresher-sales-executive-job-in-hyderabad-at-skillnest360-private-limited1779345292
IT Telesales Associate,Apptechhub,"Client Relationship Management (CRM), MS-Excel",Delhi(Hybrid),"₹ 3,20,000 - 4,00,000",1 year(s),5 days ago,https://internshala.com/job/detail/remote-it-telesales-associate-job-at-apptechhub1778914497
Junior Customer Support Executive (Gurugram),TheUnityWave,"Client Interaction, Effective Communication, Interpersonal skills, Time Management",Gurgaon,"₹ 3,20,000 - 4,00,000",No experience required,N/A,https://internshala.com/job/detail/fresher-junior-customer-support-executive-gurugram-job-in-gurgaon-at-theunitywave1778475262
TGT Chemistry Teacher For CBSE School,Narayana Schools,Teaching,Siddipet,"₹ 3,20,000 - 4,00,000",6 year(s),1 day ago,https://internshala.com/job/detail/tgt-chemistry-teacher-for-cbse-school-job-in-siddipet-at-narayana-schools1779323428
TGT Chemistry Teacher For CBSE School,Narayana Schools,Teaching,Mancherial,"₹ 3,20,000 - 4,00,000",6 year(s),1 day ago,https://internshala.com/job/detail/tgt-chemistry-teacher-for-cbse-school-job-in-mancherial-at-narayana-schools1779323427
TGT Chemistry Teacher For CBSE School,Narayana Schools,Teaching,Sircilla,"₹ 3,20,000 - 4,00,000",6 year(s),1 day ago,https://internshala.com/job/detail/tgt-chemistry-teacher-for-cbse-school-job-in-sircilla-at-narayana-schools1779323428
TGT Physics Teacher For CBSE School,Narayana Schools,Teaching,Mancherial,"₹ 3,20,000 - 4,00,000",6 year(s),1 day ago,https://internshala.com/job/detail/tgt-physics-teacher-for-cbse-school-job-in-mancherial-at-narayana-schools1779323426
TGT Mathematics Teacher For CBSE School,Narayana Schools,Teaching,Peddapalli,"₹ 3,20,000 - 4,00,000",6 year(s),1 day ago,https://internshala.com/job/detail/tgt-mathematics-teacher-for-cbse-school-job-in-peddapalli-at-narayana-schools1779323425
TGT Physics Teacher For CBSE School,Narayana Schools,Teaching,Karimnagar,"₹ 3,20,000 - 4,00,000",6 year(s),1 day ago,https://internshala.com/job/detail/tgt-physics-teacher-for-cbse-school-job-in-karimnagar-at-narayana-schools1779323425
TGT Physics Teacher For CBSE School,Narayana Schools,Teaching,Siddipet,"₹ 3,20,000 - 4,00,000",6 year(s),1 day ago,https://internshala.com/job/detail/tgt-physics-teacher-for-cbse-school-job-in-siddipet-at-narayana-schools1779323424
TGT Chemistry Teacher For CBSE School,Narayana Schools,Teaching,Karimnagar,"₹ 3,20,000 - 4,00,000",6 year(s),1 day ago,https://internshala.com/job/detail/tgt-chemistry-teacher-for-cbse-school-job-in-karimnagar-at-narayana-schools1779323424
TGT Mathematics Teacher For CBSE School,Narayana Schools,Teaching,Indira Nagar,"₹ 3,20,000 - 4,00,000",6 year(s),1 day ago,https://internshala.com/job/detail/tgt-mathematics-teacher-for-cbse-school-job-in-indira-nagar-at-narayana-schools1779323424
TGT Mathematics Teacher For CBSE School,Narayana Schools,Teaching,Karimnagar,"₹ 3,20,000 - 4,00,000",6 year(s),1 day ago,https://internshala.com/job/detail/tgt-mathematics-teacher-for-cbse-school-job-in-karimnagar-at-narayana-schools1779323424
TGT Physics Teacher For CBSE School,Narayana Schools,Teaching,Sircilla,"₹ 3,20,000 - 4,00,000",6 year(s),1 day ago,https://internshala.com/job/detail/tgt-physics-teacher-for-cbse-school-job-in-sircilla-at-narayana-schools1779323424
TGT Mathematics Teacher For CBSE School,Narayana Schools,Teaching,Sircilla,"₹ 3,20,000 - 4,00,000",6 year(s),1 day ago,https://internshala.com/job/detail/tgt-mathematics-teacher-for-cbse-school-job-in-sircilla-at-narayana-schools1779323423
TGT Mathematics Teacher For CBSE School,Narayana Schools,Teaching,Siddipet,"₹ 3,20,000 - 4,00,000",6 year(s),1 day ago,https://internshala.com/job/detail/tgt-mathematics-teacher-for-cbse-school-job-in-siddipet-at-narayana-schools1779323410
TGT Chemistry Teacher For CBSE School,Narayana Schools,Teaching,Nirmal,"₹ 3,20,000 - 4,00,000",6 year(s),2 days ago,https://internshala.com/job/detail/tgt-chemistry-teacher-for-cbse-school-job-in-nirmal-at-narayana-schools1779237024
PGT Chemistry Teacher For CBSE School,Starling International School,Teaching,Pargana,"₹ 3,20,000 - 4,00,000",5 year(s),2 days ago,https://internshala.com/job/detail/pgt-chemistry-teacher-for-cbse-school-job-in-pargana-at-starling-international-school1779237022
"Opportunity For TGT Hindi Teacher For Motihari Campus, Bihar.",Seth MR Jaipuria Schoool,"Artificial intelligence, Curriculum Development",Motihari,"₹ 3,20,000 - 4,00,000",2 year(s),5 days ago,https://internshala.com/job/detail/opportunity-for-tgt-hindi-teacher-for-motihari-campus-bihar-job-in-motihari-at-seth-mr-jaipuria-schoool1778977824
TGT Chemistry Teacher For CBSE School,Narayana Schools,Teaching,Vikarabad,"₹ 3,20,000 - 4,00,000",5 year(s),7 days ago,https://internshala.com/job/detail/tgt-chemistry-teacher-for-cbse-school-job-in-vikarabad-at-narayana-schools1778805016
TGT Chemistry Teacher For CBSE School,Narayana Schools,Teaching,Sangareddy,"₹ 3,20,000 - 4,00,000",5 year(s),7 days ago,https://internshala.com/job/detail/tgt-chemistry-teacher-for-cbse-school-job-in-sangareddy-at-narayana-schools1778805013
TGT Chemistry Teacher For CBSE School,Narayana Schools,Teaching,Tandur,"₹ 3,20,000 - 4,00,000",5 year(s),7 days ago,https://internshala.com/job/detail/tgt-chemistry-teacher-for-cbse-school-job-in-tandur-at-narayana-schools1778805010
TGT Social Science Teacher For CBSE School,Narayana Schools,Teaching,Sangareddy,"₹ 3,20,000 - 4,00,000",6 year(s),N/A,https://internshala.com/job/detail/tgt-social-science-teacher-for-cbse-school-job-in-sangareddy-at-narayana-schools1778718626
TGT English Teacher For CBSE School,Narayana Schools,Teaching,Hyderabad,"₹ 3,20,000 - 4,00,000",6 year(s),N/A,https://internshala.com/job/detail/tgt-english-teacher-for-cbse-school-job-in-hyderabad-at-narayana-schools1778718623
TGT English Teacher For CBSE School,Narayana Schools,Teaching,Kamareddy,"₹ 3,20,000 - 4,00,000",6 year(s),N/A,https://internshala.com/job/detail/tgt-english-teacher-for-cbse-school-job-in-kamareddy-at-narayana-schools1778718623
TGT Social Science Teacher For CBSE School,Narayana Schools,Teaching,Kamareddy,"₹ 3,20,000 - 4,00,000",6 year(s),N/A,https://internshala.com/job/detail/tgt-social-science-teacher-for-cbse-school-job-in-kamareddy-at-narayana-schools1778718623
TGT Mathematics Teacher For CBSE School,Narayana Schools,Teaching,Kamareddy,"₹ 3,20,000 - 4,00,000",5 year(s),N/A,https://internshala.com/job/detail/tgt-mathematics-teacher-for-cbse-school-job-in-kamareddy-at-narayana-schools1778632223
TGT Physics Teacher For CBSE School,Narayana Schools,Teaching,Adilabad,"₹ 3,20,000 - 4,00,000",6 year(s),N/A,https://internshala.com/job/detail/tgt-physics-teacher-for-cbse-school-job-in-adilabad-at-narayana-schools1778632223
TGT Physics Teacher For CBSE School,Narayana Schools,Teaching,Kamareddy,"₹ 3,20,000 - 4,00,000",6 year(s),N/A,https://internshala.com/job/detail/tgt-physics-teacher-for-cbse-school-job-in-kamareddy-at-narayana-schools1778632223
TGT Physics Teacher For CBSE School,Narayana Schools,Teaching,Sangareddy,"₹ 3,20,000 - 4,00,000",6 year(s),N/A,https://internshala.com/job/detail/tgt-physics-teacher-for-cbse-school-job-in-sangareddy-at-narayana-schools1778632223
TGT Physics Teacher For CBSE School,Narayana Schools,Teaching,Vikarabad,"₹ 3,20,000 - 4,00,000",6 year(s),N/A,https://internshala.com/job/detail/tgt-physics-teacher-for-cbse-school-job-in-vikarabad-at-narayana-schools1778632223
TGT English Teacher For CBSE School,Narayana Schools,Teaching,Nizamabad,"₹ 3,20,000 - 4,00,000",4 year(s),N/A,https://internshala.com/job/detail/tgt-english-teacher-for-cbse-school-job-in-nizamabad-at-narayana-schools1778113825
"Opportunity For TGT Computer With Seth MR Jaipuria School, Basti(UP).",Seth MR Jaipuria Schoool,"Artificial intelligence, Classroom Management, Computer, Curriculum Development, HTML, MS-Office, Python, Troubleshooting",Basti,"₹ 3,20,000 - 4,00,000",4 year(s),N/A,https://internshala.com/job/detail/opportunity-for-tgt-computer-with-seth-mr-jaipuria-school-bastiup-job-in-basti-at-seth-mr-jaipuria-schoool1777509023
